{
  "id": "arissana_rocha_nahu",
  "base_link": 0,
  "card_type_id": "runner_identity",
  "deck_limit": 3,
  "faction_id": "shaper",
  "influence_limit": 15,
  "is_unique": false,
  "minimum_deck_size": 45,
  "side_id": "runner",
  "stripped_text": "<strong>0[c]:</strong> Install 1 program from your grip <em>(paying all costs)</em>. Use this ability only once per turn and only during a run. When that run ends, trash that program if it is not a <strong>trojan</strong>.",
  "stripped_title": "Arissana Rocha Nahu",
  "subtypes": ["natural"],
  "text": "<strong>0[c]:</strong> Install 1 program from your grip <em>(paying all costs)</em>. Use this ability only once per turn and only during a run. When that run ends, trash that program if it is not a <strong>trojan</strong>.",
  "title": "Arissana Rocha Nahu"
}
